{
  "schemaVersion": 1,
  "documentType": "delivery-environment-readiness",
  "manifestId": "D0.4-READINESS-v1",
  "riskManifestId": "D0.4-v3",
  "riskManifestSha256": "3747f8520497b65544ef0cd1bb386b8e72866284001da408de111f454f0d614a",
  "baselineSha": "b7eafb683d37d80bd60b59e850311acd79d2a569",
  "verifiedSourceSha": "188a70ae6e0327acafd060a9f83fb32df7a1b54b",
  "verifiedRunId": "29921571400",
  "hostedRuntimeEvidenceSha256": "70cfdb8292a9942d921cab18beb12575102df845bd0ffa201be2a5bb39d08b1c",
  "sourceIdentityPath": "docs/verification/evidence/D0.4-source-identity.json",
  "sourceIdentitySha256": "6c638f32916656f2c7251ebc4ec0c6981fbd0990ecef948b07758d2f5f49e1fc",
  "phase": "closure",
  "collectedAt": "2026-07-22T13:02:15Z",
  "repository": {
    "nameWithOwner": "RickyT715/Aemeath_Desktop_Pet",
    "visibility": "PUBLIC",
    "defaultBranch": "main",
    "branchProtected": true,
    "rulesetCount": 0,
    "selfHostedRunnerCount": 0,
    "actionsSecretCount": 0,
    "environmentCount": 0,
    "branchProtectionPermission": "ADMIN",
    "snapshotPath": "docs/verification/evidence/D0.4-github-snapshot.md",
    "snapshotSha256": "e835a33f855036ece010e1f3cebc0876c4e9418355740331e3fca7b2323b7173",
    "evidenceRefs": ["docs/verification/evidence/D0.4-github-snapshot.md"]
  },
  "capabilities": [
    {
      "id": "CAP-BRANCH-PROTECTION",
      "category": "repository-governance",
      "state": "ready",
      "ownerRole": "repository administrator",
      "requiredForSteps": ["D0.4", "P0A.9", "P11.4"],
      "firstBlockingStep": "D0.4 closure",
      "verifiedAt": "2026-07-22T13:02:15Z",
      "evidenceRefs": ["docs/verification/evidence/D0.4-github-snapshot.md", "docs/verification/evidence/D0.4-green.md"],
      "observation": "The main branch is protected with strict Delivery Contract, .NET Release Build, Verification Contracts, and Delivery Environment checks; administrators are enforced and force-push/deletion are disabled.",
      "blockerReason": null,
      "remediation": null,
      "containsPersonalData": false,
      "containsSecretValues": false
    },
    {
      "id": "CAP-CI-ARTIFACT-RETENTION",
      "category": "evidence-storage",
      "state": "ready",
      "ownerRole": "delivery owner",
      "requiredForSteps": ["D0.4", "P0A.1", "P0A.2"],
      "firstBlockingStep": null,
      "verifiedAt": "2026-07-22T11:50:00Z",
      "evidenceRefs": ["docs/verification/evidence/D0.3-green.md", "https://github.com/RickyT715/Aemeath_Desktop_Pet/actions/runs/29917213955"],
      "observation": "All required artifacts passed exact-SHA identity, file-set, digest, size, and 90-day expiry checks.",
      "blockerReason": null,
      "remediation": null,
      "containsPersonalData": false,
      "containsSecretValues": false
    },
    {
      "id": "CAP-CODE-SIGNING",
      "category": "signing",
      "state": "blocked",
      "ownerRole": "release owner",
      "requiredForSteps": ["P11.1"],
      "firstBlockingStep": "P11.1 signed package release",
      "verifiedAt": null,
      "evidenceRefs": ["docs/verification/evidence/D0.4-github-snapshot.md"],
      "observation": "No signing environment, secret metadata, certificate identity, or hardware-backed signing service is registered.",
      "blockerReason": "The repository has no authorized Windows code-signing identity or protected signing environment.",
      "remediation": "The release owner must provision an approved certificate/service and an ephemeral protected workflow before P11.1.",
      "containsPersonalData": false,
      "containsSecretValues": false
    },
    {
      "id": "CAP-GHA-UBUNTU-EXACT-SHA",
      "category": "hosted-runner",
      "state": "ready",
      "ownerRole": "delivery owner",
      "requiredForSteps": ["D0.4", "P0A.1"],
      "firstBlockingStep": null,
      "verifiedAt": "2026-07-22T11:50:00Z",
      "evidenceRefs": ["docs/verification/evidence/D0.3-green.md", "https://github.com/RickyT715/Aemeath_Desktop_Pet/actions/runs/29917213955"],
      "observation": "Ubuntu exact-SHA delivery and PowerShell 7 verification jobs passed with retained evidence.",
      "blockerReason": null,
      "remediation": null,
      "containsPersonalData": false,
      "containsSecretValues": false
    },
    {
      "id": "CAP-GHA-WINDOWS-CAPABILITY-PROBE",
      "category": "hosted-runner",
      "state": "ready",
      "ownerRole": "delivery owner",
      "requiredForSteps": ["D0.4", "P0A.2"],
      "firstBlockingStep": "D0.4 closure",
      "verifiedAt": "2026-07-22T12:55:54Z",
      "evidenceRefs": [
        "docs/verification/evidence/D0.4-hosted-windows-capabilities.json",
        "docs/verification/evidence/D0.4-source-identity.json",
        "docs/verification/evidence/D0.4-green.md",
        "https://github.com/RickyT715/Aemeath_Desktop_Pet/actions/runs/29921571400"
      ],
      "observation": "Exact-SHA push run 29921571400 passed 36 total/9 hosted probes on Windows X64 win25-vs2026: UIA loaded; 1024x768 display; 96 DPI/100% scale; isolated storage, cleanup, GitHub TLS, timeout, and redaction passed; Narrator was not observed.",
      "blockerReason": null,
      "remediation": null,
      "containsPersonalData": false,
      "containsSecretValues": false
    },
    {
      "id": "CAP-GHA-WINDOWS-RELEASE-BUILD",
      "category": "hosted-runner",
      "state": "ready",
      "ownerRole": "delivery owner",
      "requiredForSteps": ["D0.4", "P0A.1", "P0A.2"],
      "firstBlockingStep": null,
      "verifiedAt": "2026-07-22T11:50:00Z",
      "evidenceRefs": ["docs/verification/evidence/D0.3-green.md", "https://github.com/RickyT715/Aemeath_Desktop_Pet/actions/runs/29917213955"],
      "observation": "The windows-latest Release restore/build job passed for the exact source SHA with retained logs.",
      "blockerReason": null,
      "remediation": null,
      "containsPersonalData": false,
      "containsSecretValues": false
    },
    {
      "id": "CAP-INTERACTIVE-WIN10",
      "category": "interactive-runner",
      "state": "blocked",
      "ownerRole": "infrastructure owner",
      "requiredForSteps": ["P0A.8", "P11.1"],
      "firstBlockingStep": "P0A.8 Windows 10 real-boundary lane",
      "verifiedAt": null,
      "evidenceRefs": ["docs/verification/evidence/D0.4-github-snapshot.md"],
      "observation": "No resettable interactive Windows 10 x64 worker is registered.",
      "blockerReason": "Real desktop, Narrator, DPI, tray, audio, and shell evidence cannot run without a resettable interactive worker.",
      "remediation": "Provision a named clean snapshot, ephemeral runner registration, exclusive desktop session, diagnostics, and reset proof.",
      "containsPersonalData": false,
      "containsSecretValues": false
    },
    {
      "id": "CAP-INTERACTIVE-WIN11",
      "category": "interactive-runner",
      "state": "blocked",
      "ownerRole": "infrastructure owner",
      "requiredForSteps": ["P0A.7", "P0A.8", "P11.1"],
      "firstBlockingStep": "P0A.7 process UI Automation lane when hosted Windows is not interactive",
      "verifiedAt": null,
      "evidenceRefs": ["docs/verification/evidence/D0.4-github-snapshot.md"],
      "observation": "No resettable interactive Windows 11 x64 worker is registered.",
      "blockerReason": "Real desktop, Narrator, DPI, tray, audio, and shell evidence cannot run without a resettable interactive worker.",
      "remediation": "Provision a named clean snapshot, ephemeral runner registration, exclusive desktop session, diagnostics, and reset proof.",
      "containsPersonalData": false,
      "containsSecretValues": false
    },
    {
      "id": "CAP-LONG-TERM-ARCHIVE",
      "category": "evidence-storage",
      "state": "blocked",
      "ownerRole": "infrastructure owner",
      "requiredForSteps": ["P0A.9", "P11.1", "P11.4"],
      "firstBlockingStep": "P0A.9 signed baseline archive",
      "verifiedAt": null,
      "evidenceRefs": ["docs/verification/evidence/D0.4-github-snapshot.md"],
      "observation": "GitHub Actions provides the proven 90-day working archive; no approved longer-term immutable archive is configured.",
      "blockerReason": "Release/baseline evidence that must outlive Actions retention has no owned immutable destination.",
      "remediation": "Select a least-privilege immutable archive, define retention/deletion/cost ownership, and prove exact-SHA upload/download.",
      "containsPersonalData": false,
      "containsSecretValues": false
    },
    {
      "id": "CAP-PILOT-HARDWARE-PARTICIPANTS",
      "category": "pilot",
      "state": "blocked",
      "ownerRole": "product owner",
      "requiredForSteps": ["P11.2"],
      "firstBlockingStep": "P11.2 bounded pilot",
      "verifiedAt": null,
      "evidenceRefs": ["docs/verification/evidence/D0.4-github-snapshot.md"],
      "observation": "No pilot hardware matrix, participants, consent, or support owner is registered in project evidence.",
      "blockerReason": "A privacy-respecting pilot cannot start without explicit participants, devices, consent, support, and stop criteria.",
      "remediation": "The product owner must authorize the bounded pilot and provide redacted participant/device readiness evidence before P11.2.",
      "containsPersonalData": false,
      "containsSecretValues": false
    },
    {
      "id": "CAP-PROVIDER-TERMS-CREDENTIALS",
      "category": "provider",
      "state": "blocked",
      "ownerRole": "product owner",
      "requiredForSteps": ["H0.1", "P9.1", "P9.2", "P10.3"],
      "firstBlockingStep": "H0.1 provider route and retention validation",
      "verifiedAt": null,
      "evidenceRefs": ["docs/verification/evidence/D0.4-github-snapshot.md"],